{
 "schemaVersion": 1,
 "id": "experienceProgression",
 "note": "thresholds[<CharacterClass.rawValue>][level-1] = XP mínimo do nível (níveis 1–20).",
 "classNotes": {
  "Druid": {
   "fromLevel": 15,
   "text": "From 16th level on: hierophant druid. The XP progression restarts here (PHB Table 23, \"*\"; see \"The Grand Druid and Hierophant Druids\")."
  }
 },
 "thresholds": {
  "Fighter": [
   0,
   2000,
   4000,
   8000,
   16000,
   32000,
   64000,
   125000,
   250000,
   500000,
   750000,
   1000000,
   1250000,
   1500000,
   1750000,
   2000000,
   2250000,
   2500000,
   2750000,
   3000000
  ],
  "Paladin": [
   0,
   2250,
   4500,
   9000,
   18000,
   36000,
   75000,
   150000,
   300000,
   600000,
   900000,
   1200000,
   1500000,
   1800000,
   2100000,
   2400000,
   2700000,
   3000000,
   3300000,
   3600000
  ],
  "Ranger": [
   0,
   2250,
   4500,
   9000,
   18000,
   36000,
   75000,
   150000,
   300000,
   600000,
   900000,
   1200000,
   1500000,
   1800000,
   2100000,
   2400000,
   2700000,
   3000000,
   3300000,
   3600000
  ],
  "Mage": [
   0,
   2500,
   5000,
   10000,
   20000,
   40000,
   60000,
   90000,
   135000,
   250000,
   375000,
   750000,
   1125000,
   1500000,
   1875000,
   2250000,
   2625000,
   3000000,
   3375000,
   3750000
  ],
  "Cleric": [
   0,
   1500,
   3000,
   6000,
   13000,
   27500,
   55000,
   110000,
   225000,
   450000,
   675000,
   900000,
   1125000,
   1350000,
   1575000,
   1800000,
   2025000,
   2250000,
   2475000,
   2700000
  ],
  "Druid": [
   0,
   2000,
   4000,
   7500,
   12500,
   20000,
   35000,
   60000,
   90000,
   125000,
   200000,
   300000,
   750000,
   1500000,
   3000000,
   3500000,
   500000,
   1000000,
   1500000,
   2000000
  ],
  "Thief": [
   0,
   1250,
   2500,
   5000,
   10000,
   20000,
   40000,
   70000,
   110000,
   160000,
   220000,
   440000,
   660000,
   880000,
   1100000,
   1320000,
   1540000,
   1760000,
   1980000,
   2200000
  ],
  "Bard": [
   0,
   1250,
   2500,
   5000,
   10000,
   20000,
   40000,
   70000,
   110000,
   160000,
   220000,
   440000,
   660000,
   880000,
   1100000,
   1320000,
   1540000,
   1760000,
   1980000,
   2200000
  ],
  "Ninja": [
   0,
   1250,
   2500,
   5000,
   10000,
   20000,
   40000,
   70000,
   110000,
   160000,
   220000,
   440000,
   660000,
   880000,
   1100000,
   1320000,
   1540000,
   1760000,
   1980000,
   2200000
  ]
 }
}